{
  "$schema": "https://json-schema.org/draft/2020-12/schema",
  "$id": "https://github.com/lenhonbp/MotionLoom/blob/main/schemas/fix-plan.schema.json",
  "title": "MotionLoom structured animation fix plan",
  "type": "object",
  "additionalProperties": false,
  "required": ["schema_version", "plan_id", "task_id", "status", "source_reports", "issues", "generated_at"],
  "properties": {
    "schema_version": {"const": "0.1"},
    "plan_id": {"type": "string", "pattern": "^[A-Za-z0-9][A-Za-z0-9._-]{2,127}$"},
    "task_id": {"type": "string", "pattern": "^[A-Za-z0-9][A-Za-z0-9._-]{2,127}$"},
    "status": {"type": "string", "enum": ["proposed", "accepted", "in_progress", "verified", "blocked"]},
    "source_reports": {"type": "array", "minItems": 1, "items": {"$ref": "#/$defs/report_ref"}},
    "issues": {"type": "array", "items": {"$ref": "#/$defs/issue"}},
    "generated_at": {"type": "string", "format": "date-time"},
    "next_agent": {"type": "object", "additionalProperties": false, "properties": {"action": {"type": "string"}, "skill": {"type": "string"}, "evidence_needed": {"type": "array", "items": {"type": "string"}}}}
  },
  "$defs": {
    "report_ref": {
      "type": "object",
      "additionalProperties": false,
      "required": ["path", "sha256", "kind"],
      "properties": {"path": {"type": "string", "minLength": 1}, "sha256": {"type": "string", "pattern": "^[a-f0-9]{64}$"}, "kind": {"type": "string", "enum": ["semantic-lint", "continuity", "review", "quality"]}}
    },
    "issue": {
      "type": "object",
      "additionalProperties": false,
      "required": ["id", "finding_ref", "severity", "confidence", "root_cause", "affected_artifacts", "patch_scope", "rerun_scope", "verification", "requires_user_review"],
      "properties": {
        "id": {"type": "string", "pattern": "^[A-Za-z0-9][A-Za-z0-9._-]{2,127}$"},
        "finding_ref": {"type": "string", "minLength": 1},
        "severity": {"type": "string", "enum": ["info", "warning", "error"]},
        "confidence": {"type": "number", "minimum": 0, "maximum": 1},
        "root_cause": {"type": "string", "minLength": 1},
        "affected_artifacts": {"type": "array", "items": {"type": "string", "minLength": 1}},
        "patch_scope": {"type": "array", "items": {"type": "string", "minLength": 1}},
        "rerun_scope": {"type": "array", "items": {"type": "string", "enum": ["lint", "continuity", "render", "runtime", "browser_review", "quality_gate", "replay"]}},
        "verification": {"type": "array", "items": {"type": "string", "minLength": 1}},
        "requires_user_review": {"type": "boolean"},
        "status": {"type": "string", "enum": ["open", "in_progress", "verified", "wont_fix"]}
      }
    }
  }
}
